{
  "schema": "h3.context.nle_semantic_conformance_manifest.v1",
  "version": 1,
  "corpus_version": "nle_semantic_corpus.v1",
  "tolerance_version": "nle_semantic_tolerance.v1",
  "operation_profile_id": "h3.authoring.nle_operation.v1",
  "engine_profile_id": "h3.native_media_canvas_backend.v1",
  "output_profile_id": "h3.authoring.output.h264_aac_24fps.v1",
  "joined_sources": {
    "control_coverage_manifest_sha256": "sha256:921399a9f7d1aa9f3aea76fc25c90b89e9a0c8f0fefbb22018a4ba165c5323d9",
    "sidebar_editor_ui_contract_sha256": "sha256:3a0bba2e967f413fafef6784b3a9691811a9fb390a271bac882ff8aadf68eede"
  },
  "limits": {
    "max_corpus_cases": 512,
    "max_case_payload_bytes": 131072,
    "max_report_bytes": 67108864,
    "max_case_output_frames": 384
  },
  "tolerance": {
    "version": "nle_semantic_tolerance.v1",
    "preview_max_av_drift_samples": 2000,
    "final_impulse_tolerance_samples": 2048,
    "geometry_max_abs_pixels": 2,
    "text_bounds_max_abs_pixels": 2,
    "patch_max_abs_channel": 8,
    "color_adjust_max_abs_channel": 12,
    "patch_size_px": 5,
    "patch_min_edge_distance_px": 4,
    "alpha_max_abs_error_milli": 30,
    "silence_max_abs_peak": 1,
    "codec_boundary_exclusion_samples": 2048,
    "duration_max_abs_samples": 1,
    "audio_level_relative_error_ppm": 50000,
    "audio_level_floor_ppm": 100
  },
  "counts_by_class": {
    "command": 68,
    "property": 240,
    "ui_invariant": 11,
    "import_integration": 2,
    "deferred_negative": 13
  },
  "command_rows": [
    {
      "case_id": "command.create_track.accepted",
      "family": "command",
      "leaf": "accepted",
      "supported": true,
      "refusal_expected": false,
      "command": "create_track",
      "control_operation_id": "track.add"
    },
    {
      "case_id": "command.create_track.refused",
      "family": "command",
      "leaf": "refused",
      "supported": true,
      "refusal_expected": true,
      "command": "create_track",
      "control_operation_id": "track.add"
    },
    {
      "case_id": "command.remove_track.accepted",
      "family": "command",
      "leaf": "accepted",
      "supported": true,
      "refusal_expected": false,
      "command": "remove_track",
      "control_operation_id": "track.remove"
    },
    {
      "case_id": "command.remove_track.refused",
      "family": "command",
      "leaf": "refused",
      "supported": true,
      "refusal_expected": true,
      "command": "remove_track",
      "control_operation_id": "track.remove"
    },
    {
      "case_id": "command.reorder_track.accepted",
      "family": "command",
      "leaf": "accepted",
      "supported": true,
      "refusal_expected": false,
      "command": "reorder_track",
      "control_operation_id": "track.reorder"
    },
    {
      "case_id": "command.reorder_track.refused",
      "family": "command",
      "leaf": "refused",
      "supported": true,
      "refusal_expected": true,
      "command": "reorder_track",
      "control_operation_id": "track.reorder"
    },
    {
      "case_id": "command.set_track_enabled.accepted",
      "family": "command",
      "leaf": "accepted",
      "supported": true,
      "refusal_expected": false,
      "command": "set_track_enabled",
      "control_operation_id": "track.enabled"
    },
    {
      "case_id": "command.set_track_enabled.refused",
      "family": "command",
      "leaf": "refused",
      "supported": true,
      "refusal_expected": true,
      "command": "set_track_enabled",
      "control_operation_id": "track.enabled"
    },
    {
      "case_id": "command.set_track_locked.accepted",
      "family": "command",
      "leaf": "accepted",
      "supported": true,
      "refusal_expected": false,
      "command": "set_track_locked",
      "control_operation_id": "track.locked"
    },
    {
      "case_id": "command.set_track_locked.refused",
      "family": "command",
      "leaf": "refused",
      "supported": true,
      "refusal_expected": true,
      "command": "set_track_locked",
      "control_operation_id": "track.locked"
    },
    {
      "case_id": "command.insert_asset_clip.accepted",
      "family": "command",
      "leaf": "accepted",
      "supported": true,
      "refusal_expected": false,
      "command": "insert_asset_clip",
      "control_operation_id": "asset.insert"
    },
    {
      "case_id": "command.insert_asset_clip.refused",
      "family": "command",
      "leaf": "refused",
      "supported": true,
      "refusal_expected": true,
      "command": "insert_asset_clip",
      "control_operation_id": "asset.insert"
    },
    {
      "case_id": "command.insert_title_clip.accepted",
      "family": "command",
      "leaf": "accepted",
      "supported": true,
      "refusal_expected": false,
      "command": "insert_title_clip",
      "control_operation_id": "title.insert"
    },
    {
      "case_id": "command.insert_title_clip.refused",
      "family": "command",
      "leaf": "refused",
      "supported": true,
      "refusal_expected": true,
      "command": "insert_title_clip",
      "control_operation_id": "title.insert"
    },
    {
      "case_id": "command.replace_clip_asset.accepted",
      "family": "command",
      "leaf": "accepted",
      "supported": true,
      "refusal_expected": false,
      "command": "replace_clip_asset",
      "control_operation_id": "asset.replace"
    },
    {
      "case_id": "command.replace_clip_asset.refused",
      "family": "command",
      "leaf": "refused",
      "supported": true,
      "refusal_expected": true,
      "command": "replace_clip_asset",
      "control_operation_id": "asset.replace"
    },
    {
      "case_id": "command.remove_clip.accepted",
      "family": "command",
      "leaf": "accepted",
      "supported": true,
      "refusal_expected": false,
      "command": "remove_clip",
      "control_operation_id": "clip.remove"
    },
    {
      "case_id": "command.remove_clip.refused",
      "family": "command",
      "leaf": "refused",
      "supported": true,
      "refusal_expected": true,
      "command": "remove_clip",
      "control_operation_id": "clip.remove"
    },
    {
      "case_id": "command.move_clip.accepted",
      "family": "command",
      "leaf": "accepted",
      "supported": true,
      "refusal_expected": false,
      "command": "move_clip",
      "control_operation_id": "clip.move"
    },
    {
      "case_id": "command.move_clip.refused",
      "family": "command",
      "leaf": "refused",
      "supported": true,
      "refusal_expected": true,
      "command": "move_clip",
      "control_operation_id": "clip.move"
    },
    {
      "case_id": "command.move_group.accepted",
      "family": "command",
      "leaf": "accepted",
      "supported": true,
      "refusal_expected": false,
      "command": "move_group",
      "control_operation_id": "clip.move_group"
    },
    {
      "case_id": "command.move_group.refused",
      "family": "command",
      "leaf": "refused",
      "supported": true,
      "refusal_expected": true,
      "command": "move_group",
      "control_operation_id": "clip.move_group"
    },
    {
      "case_id": "command.trim_clip.accepted",
      "family": "command",
      "leaf": "accepted",
      "supported": true,
      "refusal_expected": false,
      "command": "trim_clip",
      "control_operation_id": "clip.trim"
    },
    {
      "case_id": "command.trim_clip.refused",
      "family": "command",
      "leaf": "refused",
      "supported": true,
      "refusal_expected": true,
      "command": "trim_clip",
      "control_operation_id": "clip.trim"
    },
    {
      "case_id": "command.split_clip.accepted",
      "family": "command",
      "leaf": "accepted",
      "supported": true,
      "refusal_expected": false,
      "command": "split_clip",
      "control_operation_id": "clip.split"
    },
    {
      "case_id": "command.split_clip.refused",
      "family": "command",
      "leaf": "refused",
      "supported": true,
      "refusal_expected": true,
      "command": "split_clip",
      "control_operation_id": "clip.split"
    },
    {
      "case_id": "command.merge_clips.accepted",
      "family": "command",
      "leaf": "accepted",
      "supported": true,
      "refusal_expected": false,
      "command": "merge_clips",
      "control_operation_id": "clip.merge"
    },
    {
      "case_id": "command.merge_clips.refused",
      "family": "command",
      "leaf": "refused",
      "supported": true,
      "refusal_expected": true,
      "command": "merge_clips",
      "control_operation_id": "clip.merge"
    },
    {
      "case_id": "command.insert_range.accepted",
      "family": "command",
      "leaf": "accepted",
      "supported": true,
      "refusal_expected": false,
      "command": "insert_range",
      "control_operation_id": "range.insert"
    },
    {
      "case_id": "command.insert_range.refused",
      "family": "command",
      "leaf": "refused",
      "supported": true,
      "refusal_expected": true,
      "command": "insert_range",
      "control_operation_id": "range.insert"
    },
    {
      "case_id": "command.overwrite_range.accepted",
      "family": "command",
      "leaf": "accepted",
      "supported": true,
      "refusal_expected": false,
      "command": "overwrite_range",
      "control_operation_id": "range.overwrite"
    },
    {
      "case_id": "command.overwrite_range.refused",
      "family": "command",
      "leaf": "refused",
      "supported": true,
      "refusal_expected": true,
      "command": "overwrite_range",
      "control_operation_id": "range.overwrite"
    },
    {
      "case_id": "command.ripple_delete.accepted",
      "family": "command",
      "leaf": "accepted",
      "supported": true,
      "refusal_expected": false,
      "command": "ripple_delete",
      "control_operation_id": "range.ripple_delete"
    },
    {
      "case_id": "command.ripple_delete.refused",
      "family": "command",
      "leaf": "refused",
      "supported": true,